{
 "contract": "weaponlab-gripstyle/1",
 "id": "pistol_two_hand",
 "name": "Pistol, two hands",
 "families": [
  "pistol_slide",
  "energy_cell_pistol"
 ],
 "hands": {
  "r": {
   "role": "firing",
   "contact": {
    "mark": "grip",
    "face": [
     -0.8,
     -0.6,
     0.0
    ],
    "why": "the firing palm wraps the grip's right side and its backstrap, the web of the hand high under the tang on the backstrap's middle, so the thumb lies along the left side (FM 3-23.35 2-3); the fingers forward across the front strap, square to the grip's 18.7 degree slant",
    "fingers_toward": [
     0.0,
     0.95,
     -0.32
    ],
    "anchors": {
     "palm": [
      -3.7,
      -4.5,
      -6.0
     ],
     "middle_base": [
      -0.5,
      -0.4,
      -5.9
     ],
     "index_pip": [
      -2.9,
      -1.0,
      -3.6
     ],
     "thumb_cmc": [
      -1.5,
      -9.0,
      -4.5
     ]
    },
    "across": "grip_axis",
    "fit_source": "FM 3-23.35 (2003) figures 2-1 and 2-2: the palm on the grip's firing side, the middle finger's first segment across the front strap just under the trigger guard, the trigger finger along the frame above the guard; placed on this gun's own faces (panel x -1.67, front strap y -1.3 to -2.1, frame side x 1.75 at the guard)"
   },
   "fingers": {
    "index": {
     "pose": "posture",
     "curl": [
      0.0,
      0.0,
      3.0
     ],
     "tol": 5.0,
     "source": "Ninapro calibrated kinematics (Jarque-Bou, Atzori, Mueller 2020, CC BY 4.0), exercise 3, median of 10 subjects' steady holds; angles outside the joint's range dropped, a dropped ring angle the mean of middle and little, a dropped end joint two thirds of the middle joint; movement 4, index finger extension grasp",
     "why": "the trigger finger straight along the frame, off the trigger until the shot (FM 3-23.35 2-1)"
    },
    "middle": {
     "pose": "posture",
     "curl": [
      84.0,
      40.0,
      27.0
     ],
     "tol": 15.0,
     "source": "Ninapro calibrated kinematics (Jarque-Bou, Atzori, Mueller 2020, CC BY 4.0), exercise 3, median of 10 subjects' steady holds; angles outside the joint's range dropped, a dropped ring angle the mean of middle and little, a dropped end joint two thirds of the middle joint; movement 4",
     "why": "the middle finger wrapped round the front strap, pressing to the rear (FM 3-23.35 2-1)"
    },
    "ring": {
     "pose": "posture",
     "curl": [
      86.0,
      31.0,
      20.0
     ],
     "tol": 15.0,
     "source": "Ninapro calibrated kinematics (Jarque-Bou, Atzori, Mueller 2020, CC BY 4.0), exercise 3, median of 10 subjects' steady holds; angles outside the joint's range dropped, a dropped ring angle the mean of middle and little, a dropped end joint two thirds of the middle joint; movement 4",
     "why": "the ring finger wrapped round the front strap, pressing to the rear (FM 3-23.35 2-1)"
    },
    "pinky": {
     "pose": "posture",
     "curl": [
      87.0,
      21.0,
      14.0
     ],
     "tol": 15.0,
     "source": "Ninapro calibrated kinematics (Jarque-Bou, Atzori, Mueller 2020, CC BY 4.0), exercise 3, median of 10 subjects' steady holds; angles outside the joint's range dropped, a dropped ring angle the mean of middle and little, a dropped end joint two thirds of the middle joint; movement 4",
     "why": "the little finger wrapped round the front strap, pressing to the rear (FM 3-23.35 2-1)"
    },
    "thumb": {
     "pose": "to",
     "point": [
      2.7,
      -1.5,
      -2.4
     ],
     "via": [
      2.6,
      -7.8,
      -3.5
     ],
     "source": "Ninapro calibrated kinematics (Jarque-Bou, Atzori, Mueller 2020, CC BY 4.0), exercise 3, median of 10 subjects' steady holds; angles outside the joint's range dropped, a dropped ring angle the mean of middle and little, a dropped end joint two thirds of the middle joint; movement 4",
     "why": "the firing thumb round the backstrap's support-side rear corner and forward along the support side over the bare top of the grip panel, nearly straight (FM 3-23.35 2-1; Ninapro movement 4: MCP 7, IP 15)"
    }
   },
   "trigger": {
    "pose": "wrap",
    "max_curl": [
     45.0,
     55.0,
     30.0
    ],
    "why": "the trigger finger's pad on the trigger for the shot"
   },
   "contact_rules": [
    {
     "id": "thumb_on_frame",
     "patch": "thumb:pad",
     "region": {
      "part": "frame",
      "facing": "support_side",
      "window": {
       "y": [
        "slide_rear+0.5",
        "stop+0.5"
       ],
       "z": [
        "stop-2.6",
        "stop+0.6"
       ]
      }
     },
     "gap_cm": [
      -0.05,
      0.25
     ],
     "facing_max_deg": 50,
     "need": "required",
     "why": "the firing thumb lies forward along the support side, over the frame and the top of the grip panel the fingers leave bare, so no part of the grip is left open (FM 3-23.35 2-1: the thumb rests alongside the weapon)",
     "min_share": 0.6
    },
    {
     "id": "web_under_tang",
     "patch": "web",
     "region": {
      "part": "frame",
      "facing": "back",
      "facing_tol_deg": 70,
      "window": {
       "z": [
        "slide_rear-5.0",
        "slide_rear-2.6"
       ]
      }
     },
     "gap_cm": [
      -0.1,
      0.4
     ],
     "facing_max_deg": 75,
     "need": "required",
     "why": "the web of the hand high on the backstrap, under the tang (FM 3-23.35 (2003) 2-3: the two-hand grip)",
     "min_share": 0.3
    },
    {
     "id": "index_along_frame",
     "patch": "index:base",
     "region": {
      "part": "frame",
      "facing": "firing_side",
      "window": {
       "y": [
        "trigger-4",
        "trigger+1"
       ],
       "z": [
        "trigger-0.8",
        "trigger+1.4"
       ]
      }
     },
     "gap_cm": [
      -0.05,
      0.35
     ],
     "facing_max_deg": 60,
     "min_share": 0.3,
     "need": "required",
     "why": "the trigger finger straight along the frame's firing side above the trigger guard, off the trigger until the shot (FM 3-23.35 2-1): it sets the hand's height, and with it the thumb's"
    },
    {
     "id": "palm_on_grip",
     "patch": "palm",
     "region": {
      "part": "frame",
      "facing": [
       -0.8,
       -0.6,
       0.0
      ],
      "facing_tol_deg": 70,
      "window": {
       "z": [
        "grip-4",
        "grip+3"
       ]
      }
     },
     "gap_cm": [
      -0.1,
      0.5
     ],
     "facing_max_deg": 55,
     "need": "required",
     "why": "the palm on the grip's firing side and backstrap (FM 3-23.35 (2003) 2-3: the two-hand grip)",
     "min_share": 0.3
    },
    {
     "id": "middle_round_front",
     "patch": "middle:base",
     "region": {
      "part": "frame",
      "facing": "front",
      "facing_tol_deg": 80,
      "window": {
       "z": [
        "trigger-4.5",
        "trigger-1.6"
       ]
      }
     },
     "gap_cm": [
      -0.05,
      0.3
     ],
     "facing_max_deg": 60,
     "need": "required",
     "why": "the middle finger round the front strap just under the trigger guard (FM 3-23.35 (2003) 2-3: the two-hand grip)",
     "min_share": 0.3
    },
    {
     "id": "ring_round_front",
     "patch": "ring:base",
     "region": {
      "part": "frame",
      "facing": "front",
      "facing_tol_deg": 80,
      "window": {
       "z": [
        "trigger-6.8",
        "trigger-3.0"
       ]
      }
     },
     "gap_cm": [
      -0.05,
      0.3
     ],
     "facing_max_deg": 60,
     "need": "required",
     "why": "the ring finger round the front strap under the middle finger (FM 3-23.35 (2003) 2-3: the two-hand grip)",
     "min_share": 0.3
    },
    {
     "id": "middle_tip_on_far_panel",
     "patch": "middle:tip",
     "region": {
      "part": "frame",
      "facing": "support_side",
      "window": {
       "z": [
        "trigger-5.5",
        "trigger-1.2"
       ]
      }
     },
     "gap_cm": [
      -0.05,
      0.35
     ],
     "facing_max_deg": 60,
     "need": "optional",
     "why": "the middle fingertip reaches round onto the grip's support side (a smaller hand on a wide grip may stop on the front strap)",
     "min_share": 0.4
    }
   ],
   "wrap": {
    "region": {
     "part": "frame",
     "facing": "any",
     "window": {
      "z": [
       "grip-1",
       "grip+1"
      ]
     }
    },
    "min": 0.5
   },
   "closure": {
    "friction": 0.5,
    "sides": [
     "r"
    ]
   }
  },
  "l": {
   "role": "support",
   "contact": {
    "mark": "support",
    "face": [
     1.0,
     0.0,
     0.0
    ],
    "why": "the support palm on the grip's left side, filling what the firing hand leaves open (FM 3-23.35 2-3)",
    "anchors": {
     "web": [
      5.5,
      -4.0,
      -5.5
     ],
     "knuckle": [
      6.0,
      1.5,
      -8.5
     ]
    },
    "across": "grip_axis"
   },
   "fingers": {
    "index": {
     "pose": "posture",
     "curl": [
      26.0,
      60.0,
      40.0
     ],
     "tol": 15.0,
     "source": "Ninapro calibrated kinematics (Jarque-Bou, Atzori, Mueller 2020, CC BY 4.0), exercise 3, median of 10 subjects' steady holds; angles outside the joint's range dropped, a dropped ring angle the mean of middle and little, a dropped end joint two thirds of the middle joint; movement 5, medium wrap",
     "why": "the support index finger between the firing middle finger and the trigger guard (FM 3-23.35 2-2)"
    },
    "middle": {
     "pose": "posture",
     "curl": [
      51.0,
      16.0,
      11.0
     ],
     "tol": 20.0,
     "source": "Ninapro calibrated kinematics (Jarque-Bou, Atzori, Mueller 2020, CC BY 4.0), exercise 3, median of 10 subjects' steady holds; angles outside the joint's range dropped, a dropped ring angle the mean of middle and little, a dropped end joint two thirds of the middle joint; movement 5",
     "why": "the support fingers closed over the firing fingers (FM 3-23.35 2-2)"
    },
    "ring": {
     "pose": "posture",
     "curl": [
      51.0,
      19.0,
      13.0
     ],
     "tol": 20.0,